{
  "id": "COMP-researcher",
  "name": "Research Subagent",
  "layer": "application",
  "responsibilities": [
    "Analyze project documentation, CI/CD, conventions",
    "Produce context-research.json"
  ],
  "interfaces": [
    {
      "name": "loom_run_researcher tool",
      "type": "api",
      "contract": "spawn subagent with researcher.md prompt → context-research.json",
      "consumers": ["COMP-onboarding"]
    },
    {
      "name": "researcher.md prompt",
      "type": "file",
      "contract": "system prompt for research subagent",
      "consumers": ["COMP-spawner"]
    }
  ],
  "dependencies": ["COMP-spawner"],
  "files": [".pi/extensions/loom/subagent/prompts/researcher.md", ".pi/extensions/loom/subagent/specs.ts"],
  "status": "verified",
  "source": {
    "type": "agent-documented",
    "ref": "sdd.json"
  }
}
